{
  "schema_version": 1,
  "generated_at": "2026-07-21T12:00:00Z",
  "host": {
    "name": "desk-host",
    "bridge_version": "0.1.0"
  },
  "sessions_total": 10,
  "state_counts": {
    "running": 3,
    "idle": 0,
    "waiting": 2,
    "error": 2,
    "done": 3,
    "unknown": 0
  },
  "sessions": [
    {
      "id": "design:api",
      "agent": "mock",
      "title": "~/src/api",
      "summary": "Failed to push commit due to merge conflict in auth middleware.",
      "state": "error",
      "updated_at": "2026-07-21T11:59:00Z",
      "error": "Failed to push commit due to merge conflict in auth middleware."
    },
    {
      "id": "design:frontend",
      "agent": "mock",
      "title": "~/src/frontend/components",
      "summary": "Build aborted after ESLint errors in Button.tsx on line 142.",
      "state": "error",
      "updated_at": "2026-07-21T11:58:00Z",
      "error": "Build aborted after ESLint errors in Button.tsx on line 142."
    },
    {
      "id": "design:payment",
      "agent": "mock",
      "title": "~/src/services/payment",
      "summary": "Stripe webhook signature verification returned unexpected status.",
      "state": "waiting",
      "updated_at": "2026-07-21T11:57:00Z"
    },
    {
      "id": "design:terraform",
      "agent": "mock",
      "title": "~/src/infra/terraform",
      "summary": "S3 bucket policy update may expose sensitive logging prefix.",
      "state": "waiting",
      "updated_at": "2026-07-21T11:56:00Z"
    },
    {
      "id": "design:logger",
      "agent": "mock",
      "title": "~/src/utils/logger",
      "summary": "Refactored winston transport to use structured JSON output.",
      "state": "done",
      "updated_at": "2026-07-21T11:55:00Z"
    },
    {
      "id": "design:cli",
      "agent": "mock",
      "title": "~/src/cli/commands",
      "summary": "Added --dry-run flag and validated against production schema.",
      "state": "done",
      "updated_at": "2026-07-21T11:54:00Z"
    },
    {
      "id": "design:user",
      "agent": "mock",
      "title": "~/src/models/user",
      "summary": "Migrated legacy password hash column to argon2 format.",
      "state": "done",
      "updated_at": "2026-07-21T11:53:00Z"
    },
    {
      "id": "design:orders",
      "agent": "mock",
      "title": "~/src/api/routes/orders",
      "summary": "Running integration tests against staging database cluster.",
      "state": "running",
      "updated_at": "2026-07-21T11:52:00Z",
      "progress": 0.62
    },
    {
      "id": "design:android",
      "agent": "mock",
      "title": "~/src/mobile/android",
      "summary": "Syncing Gradle dependencies and compiling native modules.",
      "state": "running",
      "updated_at": "2026-07-21T11:51:00Z",
      "progress": 0.35
    },
    {
      "id": "design:docs",
      "agent": "mock",
      "title": "~/src/docs/content",
      "summary": "Generating static site with updated OpenAPI specification.",
      "state": "running",
      "updated_at": "2026-07-21T11:50:00Z",
      "progress": 0.8
    }
  ]
}
